{
    "ApplicationID": "customer-360",
    "ApplicationName": "Customer 360",
    "ApplicationDescription": "A program that tracks all the touchpoints for a customer.",
    "Owner": "John Doe",
    "CurrentDevelopmentStatus": "in-development",
    "Questions": [
      {
        "QuestionID": "Q1",
        "QuestionText": "What was the last product purchased by the customer?",
        "QuestionPriority": "high",
        "QuestionParameters": [
          {
            "ParameterName": "CustomerID",
            "ParameterValue": "12345"
          }
        ],
        "GSQL_Query": "SELECT last_product FROM purchases WHERE customer_id = @CustomerID",
        "GSQL_QueryStatus": "done"
      },
      {
        "QuestionID": "Q2",
        "QuestionText": "What is the total spending of the customer this year?",
        "QuestionPriority": "medium",
        "QuestionParameters": [
          {
            "ParameterName": "CustomerID",
            "ParameterValue": "12345"
          },
          {
            "ParameterName": "Year",
            "ParameterValue": "2024"
          }
        ],
        "GSQL_Query": "SELECT SUM(amount) FROM transactions WHERE customer_id = @CustomerID AND YEAR(transaction_date) = @Year",
        "GSQL_QueryStatus": "in-development"
      }
    ]
  }
  